{
  "schema_version": "1.0",
  "manifest_id": "scaffold.example-project",
  "project_id": "example-project",
  "boundary_path": "BOUNDARY.md",
  "registry_path": "governance/files.registry.json",
  "profile_path": "governance/starter.profile.json",
  "routes_path": "governance/intent.routes.json",
  "workflow_contract_path": "workflow.contract.json",
  "required_paths": [
    "README.md",
    "BOUNDARY.md",
    "WORKFLOW.md",
    "workflow.contract.json",
    "rules.contract.json",
    "agent.contract.json",
    "workflow.state.json",
    "workflow.events.jsonl",
    "status.projection.json",
    "objects",
    "governance",
    "governance/files.registry.json",
    "governance/intent.routes.json",
    "governance/scaffold.manifest.json",
    "governance/starter.profile.json",
    "skills",
    "skills/review-skill",
    "skills/review-skill/SKILL.md"
  ],
  "tracked_globs": [
    "objects/*.json",
    "governance/*.json",
    "skills/*/SKILL.md"
  ]
}
